{
  "task_id": "pcc-v1-013",
  "verdict": "PASS",
  "verified_at": "2026-07-03T20:20:00-06:00",
  "completion_criteria_checked": [
    "A local deterministic script exists that appends one well-formed JSON line per event to .cockpit/logs/routing-log.jsonl.",
    "The script validates event/result type against a small explicit set rather than accepting arbitrary free text for that field.",
    "The script is strictly append-only: it never rewrites, reorders, or removes any existing line in routing-log.jsonl.",
    "The script can derive an entry directly from the current .cockpit/result/verification-result.json (task_id, verdict, summary) so a verifier does not have to hand-type the JSON for a verification event.",
    "Recorded detail is factual (what happened) rather than open-ended narrative justification.",
    "The change stays within the approved V1 scope, remains non-blocking, and does not gate or block any task cycle.",
    "Claude returns evidence in .cockpit/result/worker-result.md using the required format."
  ],
  "evidence_reviewed": [
    "scripts/log-event.ps1",
    "docs/HANDOFF_PACKET_SPEC.md",
    ".cockpit/result/worker-result.md",
    "grep for Add-Content/Set-Content/Remove-Item/Clear-Content in scripts/log-event.ps1 (only one write call: Add-Content)",
    "independent scratch-copy reproduction: invalid EventType guard re-tested without a shell pipe masking the exit code (worker's own first attempt had this masking issue, caught and corrected in their own testing too)",
    "independent scratch-copy reproduction: derived mode tested against a different verification-result.json than the worker used (pcc-v1-011's archived PASS record rather than pcc-v1-012's live one), confirming correct task_id/event_type/detail derivation",
    "independent append-only check: diffed the first N lines of the scratch log before/after test writes, byte-for-byte identical",
    "git diff --stat -- docs/HANDOFF_PACKET_SPEC.md"
  ],
  "missing_evidence": [],
  "out_of_scope_findings": [],
  "risks": [
    "This tool only fixes hand-typing drift; it does not fix the deeper 'someone has to remember to run it' problem, which is explicitly out of scope here (that's IDEA-001, currently deferred).",
    "routing-log.jsonl now permanently contains two structurally different line shapes (old route/reason/result vs new event_type/detail); any future reader of this file needs to handle both.",
    "-FromVerificationResult has no built-in staleness check; running it against an already-superseded verification-result.json would log a correct-but-late entry with nothing flagging the delay.",
    "Self-verification note (DECISION-019): this verification was performed by the same session that acted as worker. Mitigated by independently re-running the guard-condition and derived-mode tests from a fresh scratch copy using different source data (a different archived verification result) than the worker used, and by independently confirming the append-only guarantee via a fresh diff rather than trusting the worker's reported result."
  ],
  "summary": "Independently re-ran log-event.ps1's key claims from a fresh scratch copy: confirmed only Add-Content is used to write (structural append-only guarantee), re-tested the invalid-EventType guard with a correctly-checked exit code (the worker's own first test attempt had a shell-pipe masking issue, which they caught themselves), tested derived mode against a different archived verification result than the worker used and confirmed correct task_id/event_type/detail derivation, and independently confirmed via diff that prior log lines were untouched. All completion criteria met; no out-of-scope changes found.",
  "next_action": "Advance task-state.json to complete via scripts/advance-cockpit-state.ps1, run doctor.ps1 to confirm repo health, refresh the advisor brief if stale, archive this cycle's artifacts, log this verification event via scripts/log-event.ps1 -FromVerificationResult (dogfooding the tool this task just built), and commit the verified work locally (push requires separate explicit owner approval per DECISION-020).",
  "state_update_allowed": true
}
