{
  "task_id": "pcc-pathD-003",
  "verdict": "PASS",
  "verified_at": "2026-07-05T20:55:00-06:00",
  "completion_criteria_checked": [
    "The subprocess-call exception is confirmed scoped exactly as claimed: the script reads project-state.json, task-state.json, verification-result.json, and routing-log.jsonl directly, treats worker-result.md as a path-only pointer, invokes exactly one subprocess (scripts/classify-routing.ps1, via an explicit parameterized call), writes only the dashboard output file, creates only its parent directory if missing, and has no code path that writes into .cockpit/.",
    "The 'mirrors doctor.ps1' justification is confirmed basically sound (both use explicit subprocess + stdout/exit-code consumption, no shared in-process state) though not a perfect one-to-one match (doctor.ps1 is an aggregator by design; this script previously operated under a stricter no-other-script-calls contract) -- judged a legitimate precedent, not a stretched one, and correctly treated as a narrow exception rather than a new blanket pattern.",
    "All four degrade-gracefully cases (missing/empty routing log, one malformed line among valid ones, missing classify-routing script, classify-routing non-zero exit) confirmed genuinely implemented in code, not merely asserted -- each produces an explicit inline message and no crash. Confirmed the core-state failure path (malformed task-state.json) is unchanged and still correctly fails the whole dashboard via the existing Read-Json/Fail path.",
    "Reviewer's advisory judgment on the subprocess-vs-shared-data-file design question: shelling out to classify-routing.ps1 is a reasonable bounded choice for Phase D1 specifically because it avoids duplicating that script's classification logic (which would risk two implementations silently drifting apart); a shared structured data file would likely be the cleaner long-term design if this panel becomes more structured later, but that is not required for this task."
  ],
  "evidence_reviewed": [
    "scripts/generate-dashboard.ps1 (full file, read via remote repo access)",
    ".cockpit/result/worker-result.md (full file)",
    "docs/DECISIONS.md (DECISION-093)",
    ".cockpit/state/task-state.json",
    "scripts/doctor.ps1 (for the composition-pattern comparison)"
  ],
  "missing_evidence": [],
  "out_of_scope_findings": [],
  "risks": [
    "Minor, disclosed, non-blocking: scripts/generate-dashboard.ps1's header comment block still contains the older blanket 'calls no other script' statement alongside the newer pcc-pathD-003 exception language -- not functionally harmful, but internally inconsistent and worth a cleanup pass in a future task.",
    "Minor, disclosed, non-blocking: capturing classify-routing.ps1's full stdout as opaque display text is intentionally loose coupling -- correct for a read-only advisory panel, but means the dashboard has no structured understanding of what it displays.",
    "This verification was performed via the ChatGPT manual bridge (DECISION-086) with remote, read-only repo access only -- no local execution, no independent re-run of scripts/verify-handback-guardrails.ps1 or other local guardrails. Per docs/VERIFICATION_RESULT_SPEC.md, this is additive review, not a substitute for local-guardrail-based independent verification."
  ],
  "summary": "The new Local Tools and Routing History panels are correctly scoped: exactly one other script (classify-routing.ps1) is invoked, as an explicit, failure-tolerant subprocess call, and the doctor.ps1 composition-pattern comparison used to justify this exception holds up as a legitimate (if imperfect) precedent. All claimed graceful-degradation behavior is genuinely implemented in code and confirmed by the reviewer, and the malformed-core-state failure path is unchanged. The reviewer independently judged the subprocess design reasonable for this phase, preferring it to duplicating classification logic, while noting a shared structured data file could be a cleaner long-term evolution. Two minor, disclosed, non-blocking notes (a stale header comment; intentionally opaque stdout coupling) do not affect the verdict.",
  "next_action": "Mark task complete. Phase D1 (pcc-pathD-001 through pcc-pathD-003) is now fully delivered and verified. Prepare the next bounded task, pcc-pathD-004 (Phase D2, auto-refresh/watch mode), per docs/PATH_A_PLAN.md section 6. Consider folding the disclosed header-comment cleanup into that task's scope as minor housekeeping.",
  "state_update_allowed": true
}
