{
  "task_id": "pcc-brr2-001",
  "verdict": "PASS",
  "verified_at": "2026-07-03T23:06:00-06:00",
  "completion_criteria_checked": [
    "task-state schema and live task-state gain one explicit BRR task safety class field limited to the four canonical classes defined in docs/BRR_POLICY.md: A, B, C, and D.",
    "The live task for pcc-brr2-001 is classified explicitly using that field, and the chosen class is justified by the existing BRR policy rather than invented ad hoc.",
    "The generated worker directive and advisor restart brief both surface the active task's class clearly, so a fresh worker or advisor can see the safety classification without re-deriving it from policy prose.",
    "docs/HANDOFF_PACKET_SPEC.md, docs/STATE_MODEL.md, docs/REPO_GOVERNANCE.md, README.md, and docs/DECISIONS.md are updated only where this new live task-class field makes them stale.",
    "Local validation remains healthy on the actual returned-for-verification repo state: any touched generators, schemas, or state files work cleanly with scripts/check-schemas.ps1, scripts/validate-cockpit-state.ps1, and scripts/doctor.ps1 after the final state and status changes for handoff are complete.",
    "No automatic stop triggers, owner-decision capture flow, acceptance-boundary enforcement, or autonomous task-selection behavior is introduced."
  ],
  "evidence_reviewed": [
    ".cockpit/result/worker-result.md",
    ".cockpit/state/task-state.json",
    ".cockpit/state/project-state.json",
    ".cockpit/handoff/worker-directive.md",
    ".cockpit/handoff/advisor-restart-brief.md",
    "schemas/task-state.schema.json",
    "scripts/generate-worker-directive.ps1",
    "scripts/generate-advisor-restart-brief.ps1",
    "docs/STATE_MODEL.md",
    "docs/HANDOFF_PACKET_SPEC.md",
    "docs/REPO_GOVERNANCE.md",
    "docs/DECISIONS.md",
    "pwsh -NoProfile -File .\\scripts\\check-schemas.ps1",
    "pwsh -NoProfile -File .\\scripts\\validate-cockpit-state.ps1",
    "powershell -ExecutionPolicy Bypass -File .\\scripts\\doctor.ps1"
  ],
  "missing_evidence": [],
  "out_of_scope_findings": [],
  "risks": [
    "The underlying sequencing gap is still structural: the worker can satisfy this task by discipline, but the repo does not yet force the correct final handback order automatically.",
    "That sequencing gap should be treated as the next bounded hardening task rather than silently assumed solved just because this cycle now passes."
  ],
  "summary": "The original fielding work is complete, in scope, and now handed back cleanly. task_safety_class is added to schema and live state, surfaced in both generated handoff artifacts, the task's own Class B classification is justified correctly, and the final returned-for-verification repo state now passes check-schemas.ps1, validate-cockpit-state.ps1, and doctor.ps1 with no issues. The earlier failure was real, but it was a handback-ordering defect rather than a defect in the task's substantive output; that ordering defect is now corrected in the actual evidence being verified here.",
  "next_action": "Task 'pcc-brr2-001' is complete and verified PASS. Advisor drafts the next bounded BRR Phase 2 task focused on making final worker handback ordering deterministic.",
  "state_update_allowed": true
}
