{
  "task_id": "pcc-v1-012",
  "verdict": "PASS",
  "verified_at": "2026-07-03T19:45:00-06:00",
  "completion_criteria_checked": [
    "A local deterministic safe-stop command exists that composes existing checks (state consistency and restart safety) into one readable 'safe to stop' summary.",
    "The command surfaces the current canonical next_action from task-state.json/project-state.json without inventing new status or rewriting it.",
    "The command does not advance task status, write verification verdicts, or gate/block anything; it is read-only aside from any explicitly-scoped derived refresh it performs.",
    "The summary clearly tells a human what to read first and what the next action is, so a fresh session can resume cold.",
    "The change stays within the approved V1 scope and preserves local deterministic behavior.",
    "Claude returns evidence in .cockpit/result/worker-result.md using the required format."
  ],
  "evidence_reviewed": [
    "scripts/safe-stop.ps1",
    "docs/HANDOFF_PACKET_SPEC.md",
    ".cockpit/result/worker-result.md",
    "powershell -ExecutionPolicy Bypass -File scripts/safe-stop.ps1 (live repo, independent re-run)",
    "grep for Set-Content/ConvertTo-Json write patterns in scripts/safe-stop.ps1 (none found touching state/handoff files)",
    "independent scratch-copy reproduction: blanked project-state.json's next_expected_action (a different field than the worker's own test, for broader coverage), confirmed the cascading restart-safety ISSUE and missing-next-action ISSUE both surfaced correctly",
    "md5sum of task-state.json, project-state.json, worker-directive.md, advisor-restart-brief.md before/after the scratch-copy run, confirming only the deliberately pre-edited file changed and safe-stop.ps1 wrote nothing",
    "git diff --stat / git diff -- docs/HANDOFF_PACKET_SPEC.md"
  ],
  "missing_evidence": [],
  "out_of_scope_findings": [],
  "risks": [
    "safe-stop.ps1 shells out to pwsh for its two composed checks, inheriting the same environment dependency already accepted for doctor.ps1 and the restart-safety scripts.",
    "The 'resume by reading' list is a fixed, hand-authored path list rather than dynamically derived the same way generate-advisor-restart-brief.ps1 builds its Read First list; a future canonical read-first file would need a matching manual update here.",
    "The ANSI-stripping helper is duplicated between doctor.ps1 and safe-stop.ps1 rather than shared, a minor maintenance duplication accepted to keep each script self-contained.",
    "Self-verification note (DECISION-019): this verification, and the task drafting that preceded it, were both performed by the same session acting as advisor and worker. Mitigated by independently re-running the checks from a fresh scratch copy (a different field than the worker tested) rather than only reading the worker's narrative, and by finding and fixing a real doc wording defect the worker introduced before accepting the result."
  ],
  "summary": "Independently re-ran safe-stop.ps1 against the live repo and against a fresh scratch copy with a different field blanked than the worker tested (project-state.json's next_expected_action rather than task-state.json's next_action), confirming the same cascading ISSUE behavior and, critically, confirming via before/after checksums that the script wrote nothing to any of the four key files - the read-only guarantee holds. Found and fixed a garbled sentence in the worker's docs/HANDOFF_PACKET_SPEC.md addition before accepting the result. All completion criteria met; no out-of-scope changes found.",
  "next_action": "Advance task-state.json to complete via scripts/advance-cockpit-state.ps1, run doctor.ps1 to confirm repo health, refresh the advisor brief if stale, archive this cycle's artifacts, and commit the verified work locally (push requires separate explicit owner approval per DECISION-020).",
  "state_update_allowed": true
}
