{
  "task_id": "pcc-pathD-005",
  "verdict": "PASS",
  "verified_at": "2026-07-05T21:45:00-06:00",
  "completion_criteria_checked": [
    "The worker's core factual claim was independently confirmed: the existing Local Tools Panel and Routing History panel already render 'current route' and 'routing history' in full, so a separate, literally-worded Session/Usage panel repeating them would have been genuine duplication, not the worker's opinion.",
    "The scope-narrowing judgment (reference the existing panels instead of duplicating them; add only the honest non-fabrication disclosure) was independently evaluated as reasonable and consistent with DECISION-075's own prior determination that a real usage/pressure metric cannot be honestly built pre-checkpoint. Reviewer's one caveat: this is an interpretation of intent, not a literal implementation of a separately-labeled summary panel -- but nothing in the plan text or DECISION-075 favors duplication over the honest-disclosure reading.",
    "The disclosure text was independently judged explicit and specific enough to satisfy the 'don't pretend to measure what you can't measure' requirement -- direct, bolded, its own section, not vague or buried."
  ],
  "evidence_reviewed": [
    "scripts/generate-dashboard.ps1 (full file, read via remote repo access, including the new Session/Usage section and updated header comment)",
    ".cockpit/result/worker-result.md (full file)",
    "docs/DECISIONS.md (DECISION-095, and DECISION-075 for context)",
    "docs/PATH_A_PLAN.md section 6 (the pcc-pathD-005 line, compared against what was actually built)",
    ".cockpit/state/task-state.json"
  ],
  "missing_evidence": [],
  "out_of_scope_findings": [],
  "risks": [
    "Minor, disclosed, non-blocking: the new Session/Usage section is two paragraphs (a pointer plus a disclosure), not a structured table like the other panels -- reviewer judged this acceptable since there is no genuinely new structured data to show, only worth noting for anyone expecting visual parallelism across panels.",
    "This verification was performed via the ChatGPT manual bridge (DECISION-086) with remote, read-only repo access only -- no local execution, no independent re-run of scripts/verify-handback-guardrails.ps1 or other local guardrails. Per docs/VERIFICATION_RESULT_SPEC.md, this is additive review, not a substitute for local-guardrail-based independent verification."
  ],
  "summary": "The worker's scope-narrowing judgment on pcc-pathD-005 (referencing the existing Local Tools/Routing History panels rather than duplicating them, and adding only the honest non-fabrication disclosure) was independently verified rather than taken at face value: the reviewer confirmed the earlier panels genuinely already cover the plan's literal 'current route'/'routing history' ask, confirmed the judgment call is consistent with DECISION-075's own prior honesty determination, and confirmed the disclosure text is explicit and specific enough to satisfy the no-fabrication requirement. No blocker found; one minor, disclosed, non-blocking note about the section's lighter-weight presentation format.",
  "next_action": "Mark task complete. Prepare the next bounded task, pcc-pathD-006 (Handoff/Rollover panel, read-only), per docs/PATH_A_PLAN.md section 6.",
  "state_update_allowed": true
}
